年分,標題
2004,"邱俊誠、林育成, “以微機電技術設計製作應用於光置入擷取多工器之光切換元件,”電子月刊 , 2004年1月號107期"
2003,"J.-C. Chiou* and Y. C. Lin, “A Multiple Electrostatic Electrodes Torsion Micromirror Device with Linear Stepping Angle Effect,”Journal of Microelectromechanical Systems, Vol. 12, No. 6, Dec. 2003, pp. 913-920. (MOEA 91-EC-17-A-07-S1-0011, NSC 91-2215-E-009-028) (EI, SCI, IF:3.005, Top 5%)"
2003,"Y. C. Lin, J.-C. Chiou*, and C. L. Chen, “A Digital/Analog Actuating Mechanism for Optical Applications”, International Journal of Computational Engineering Science, Vol. 4, No. 3, Sep. 2003, pp. 435-438. (NSC 91-2215-E-009-028)"
2003,"J.-C. Chiou* and Y. J. Lin, “A new modeling method of vertical electrostatic comb drives”, International Journal of Computational Engineering Science, Vol. 4, No. 3, Sep. 2003, pp. 641-644. (NSC 91-2215-E-009-028)"
2003,"Y. C. Lin, J.-C. Chiou*, W. T. Lin, Y. J. Lin, and S. D. Wu, “The Design and Assembly of Surface-Micromachined Optical Switch for Optical Add/Drop Multiplexer Application”, IEEE Transactions on Advanced Packaging, Vol. 26, No. 3, Aug. 2003, pp. 261-267. (MOEA 91-EC-17-A-07-S1-0011, NSC 91-2215-E-009-028) (EI,SCI,IF:1.254, Top 10%)"
2003,"W. T. Lin and, J.-C. Chiou*, “Multi-Directional Dual Comb-Drive Actuator for Optical Applications”, International Journal of Computational Engineering Science, Vol. 4, No. 2, June, 2003, pp. 201-204. (NSC 91-2215-E-009-028)"
2003,"J.-C. Chiou* and Y. J. Lin, “A Novel Application of Contact Friction for Laterally Motion Tunable Acceleration-threshold Switch:Modeling and Simulation”, International Journal of Computational Engineering Science, Vol. 4, No. 2, June, 2003, pp. 417-420. (NSC 91-2215-E-009-028)"
2003,"C. H. Ko and J.-C. Chiou*, “Optimal Design of the Magnetic Microactuator Using the Genetic Algorithm”Journal of Magnetism and Magnetic Materials, 263, 2003, pp 38-46. (NSC 91-2215-E-009-028) (EI,SCI,IF:0.985)
2002,"Y. W. JanandJ.-C. Chiou*,“Unloading Law For A LEO Spacecraft with Two-Gimbals Solar Array,”ActaAstronautica,Vol. 51, No. 12, pp.843~854, 2002. (EI,SCI,IF:0.209)"
2002,"楊昭中、柯春旭、戴志銘、林景崎、邱俊誠,“電磁式平面微電感的製作及應用”, 科儀新知第二十四卷一期 (129 期), 中華民國九十一年八月, pp. 5-12."
2002,"W. T. Lin,J.-C. Chiou*, and B. C. S. Chou “A photonic device compatible process in fabricating tunable Fabry-Perot filter,”Optics Communications, 210, 2002, pp. 149-154. (NSC90-2215-E-009-101) (EI,SCI,IF:1.456)"
2002,"C. H. Ko, J. J. Yang, and J.-C. Chiou*, “Efficient magnetic microactuator with an enclosed magnetic core,”Journal of Microlith.,Microfab., Microsyst., Vol. 1, No. 2, 2002, pp. 144-149. (NSC90-2215-E-009-101)"
2002,"Jauh-Jung Yang, Chun-Hsu Ko, Chih-Ming Tai, Jing-Chie Lin, Jin-Chern Chiou, “Fabrication and Application of Magnetic Micro Planer Inductor,” Instruments Today, Vol.24, No.1,pp. 5-12, 2002."
2002,"林煒挺、周正三、邱俊誠,“微型光學調頻元件及其應用驅勢”,光訊, 第九十四期, 中華民國九十一年, pp7-10, 2002."
2002,"邱俊誠、林育成、張伊甄、林永峻,“應用光微機電技術發展之微鏡面系統(上)”, 光訊, 第四十九期, 中華民國九十一年, pp11-15, 2002."
2002,"邱俊誠、林育成、張伊甄、林永峻,“應用光微機電技術發展之微鏡面系統(下)”, 光訊, 第五十期, 中華民國九十一年, pp32-36, 2002."
2001,"J.-C. Chiou*, Y. W. Janand S. D. Wu,“A Family of Constraint Preserving Integrators for Solving Quaternion Equations,”Journal of Guidance, Control, and Dynamics, Vol. 24, No.1., Jan.-Feb., 2001, pp.72-78. (EI,SCI,IF:0.946)"
2000,"S. D. Wu, J.-C. Chiou*, and Y. C. Lin, “Modified Adam-Moulton Predictor Corrector Method in Solving Multibody Dynamical Systems,”Mechanics of Structures and Machines, 28(2&3), 2000, pp.201-208. (SCI,IF:0.415)"
2000,"邱俊誠、林育成,“以熱致動器為主之微系統應用,”微系統科技協會季刊,第二期, 中華民國八十九年十月, pp. 69-76."
2000,"邱俊誠, “次世代數位影音多用途光碟系統之光機電整合研究-主走軸馬達伺服控制,”工程科技通訊-電機, 第四十八期, 中華民國八十九年六月, pp. 75-78."
1999,"J.-C. Chiou*and S. D. Wu,“On the Generation of Higher Order Numerical Integration Methods Using Lower Order Adams-Bashforth and Adams-Moulton Methods,”Journal ofComputational and Applied Mathematics, 108, 1999, pp. 19-29. (EI,SCI,IF:0.569)"
1999,"S. D. Wu,J.-C. Chiou* and J. Y. Yang, “A New Constraint Stabilization Technique for Dynamic Systems with Nonholonomic Constraints,”Journal of Guidance Navigation, Dynamics and Control, Vol. 22, No. 3, 1999, pp. 497-499. (EI,SCI,IF:0.946)"
1999,"邱俊誠, “光碟機系統跨軌漏數補償法之研究,”工程科技通訊-電機, 第三十八期, 中華民國八十八年六月, pp. 17-19."
1999,"J.-C. Chiou*,J. Y. Yang and S. D. Wu,“Stability Analysis of Baumgarte Constraint Stabilization Technique in Multibody Dynamic Systems,”Journal of Guidance Navigation, Dynamics and Control, Vol. 22, No. 1, Jan.-Feb., 1999, pp. 160-162. (EI,SCI,IF:0.946)"
1998,"J.-C. Chiou* and J. Y. Yang, “A CVD epitaxial deposition in a vertical barrel reactor:process modeling using cluster based fuzzy logic models,”IEEE Transactions on Semiconductor Manufacturing, Vol. 11, No. 4, Nov., 1998, pp. 645-653. (EI,SCI,IF:0.774)"
1998,"J.-C. Chiou*, J.-C. Yu, Y. C. Lin and S. J. Chen “The Fabrication, Analysis and Study of Three-layer Polysilicon Micro-Sliding System, ”Journal of the Mechatronic Industry, Issue 185, Aug. 1998, pp.128-137."
1998,"邱俊誠、高崇洋, “堆高機傾覆預警裝置細部設計及分析,”勞工安全衛生研究季刊,中華民國八十七年九月,第六卷,第三期, pp.1-13."
1998,"邱俊誠, 余志誠, 林育成, 陳世洲, “三層多晶矽電熱式微致動器及微滑桿致動系統之製作分析與研究,”機械工業雜誌, 87年8月號, p.128-137."
1998,"邱俊誠, “高倍速多媒體光碟機與次世代影音光碟系統之伺服控制系統之研究,”工程科技通訊-電機, 第三十一期, 中華民國八十七年六月, pp. 106-109."
1998,"J.-C. Chiou*and S. D. Wu, “Constraint Violation Stabilization Using Input-Output Feedback Linearization in Multibody Dynamic Analysis,”Journal of Guidance Navigation, Dynamics and Control, Vol. 21, No. 2, March-April, 1998, pp. 222-228. (EI,SCI,IF:0.946)"
1997,"J.-C. Chiou*and S. D. Wu, “Open Newton-Cotes Differential Methods as Multi-layer Sympletic Integrators,”Journal of Chemical Physics, Nov. 1, 1997, Issue 107, pp. 6894-6898. (EI,SCI, IF: 3.138)"
1997,"J.-C. Chiou*, M. C. Hwang, S. D. Wu, and J. Y. Yang, “Robust Attitude Control of Spacecraft Using Sliding Mode Control and Productive Network,”International Journal of Systems Science, Vol. 28, No. 5, 1997, pp. 435-446. (SCI,IF:0.212)"
1995,"J.-C. Chiou*, I-Shiou Chen and Shuess-Der Wu, “Nonlinear Optimal Flight Control via the Chebyshev Polynomials,”Transactions of Aeronautical and Astronautical Society of the R.O.C. vol. 27, Number 1, 1995, pp. 41-49."
1993,"Chiou, J. C*., Park, K. C., Farhat, C., “A Natural Partitioning Scheme for Parallel Simulation of Multibody Systems,”International Journal for Numerical Methods in Engineering, Vo1. 36, 1993, pp. 945-967. (EI,SCI,IF:1.203)"
1993,"Park, K, C., and Chiou, J.-C., “A Discrete Momentum-Conserving Explicit Algorithm for Rigid Body Dynamics Analysis,”International Journal for Numerical Method in Engineering, Vol. 36, 1993, pp.1071-1083. (EI,SCI,IF:1.203)"
1992,"Downer, J. D., Park, K. C., Chiou, J.-C., “ Dynamics of Flexible Beams for Multibody Systems: A Computational Procedure,”Computer Methods in Applied Mechanics and Engineering, 96, 1992, pp.373-408."
1992,"Natori, M. C., Park, K. C., Chiou, J.-C., and Namba, H., “Application of Adaptive Structure Concepts to Construction of Space System in Orbit: Concepts and Formulation,”Journal of Intelligent Material System and Structures, Vol. 3, No. 4, Oct. 1992, pp.719-734."
1992,"Park, K. C., Downer, J. D., Chiou, J.-C., and Farhat, C., “A Modular Multibody Analysis Capability for High-Precision, Active Control and Real-Time Applications, ”International Journal for Numerical Method in Engineering, Vol. 32, No. 8, 1992, pp.1767-1798. (EI,SCI,IF:1.203)"
1990,"Park, K. C., Chiou, J.-C., and Downer, J. D., “Explicit-Implicit Staggered Procedure for Multibody Dynamics Analysis, ”Journal of Guidance, Control, and Dynamics, Vol. 13, No. 3, May-June, 1990, pp. 562-570. (EI, SCI, IF:0.946)"
1990,"Chiou, Jin-Chern, ”Constraint treatment techniques and parallel algorithms for multibody dynamic analysis,”NASA Center:NASA, 1990, Added to NTRS:2005-08-25, Accession Number:91N13759; Document ID:19910004446;Report Number:CU-CSSC-90-26, NAS 1.26:187668, NASA-CR-187668"
1988,"Park, K. C., and Chiou, J.-C., “Stabilization of Computational Procedures for Constrained Dynamical System, ”Journal of Guidance, Control and Dynamical System, 1988, Vol. 11, No. 4, pp. 365-370. (EI,SCI,IF:0.946)"
